{
  "schema_version": "publication_receipt.v4",
  "receipt_id": "receipt-v4-8e5796b5435b2f8f7644c089907e86d64c1686309fc89b80965874e22a8aa285",
  "publication_id": "release-example-mixed",
  "authority_ref": "repository-mixed@3.0.0",
  "published_at": "2026-09-12T12:05:00Z",
  "published_by": "example-release-publisher",
  "bundle_hash": "sha256:8e5796b5435b2f8f7644c089907e86d64c1686309fc89b80965874e22a8aa285",
  "source_snapshot_hash": "sha256:d09939a41b7e335165ecebffc714064c816c6465dc5afee8ee3702946d1d94bf",
  "source_clauses_hash": "sha256:24cbd34f1eaf959c101ecb772264da1413d9f7f29e0f83632e8dc60c82a61bcb",
  "policy_translation_commitment_hash": "sha256:5eaedc7ebec53cb25bfb2e557c2ba513036d9fd0ff9b1b05344907fc3c5eb909",
  "confirmed_controls_hash": "sha256:0956e35f16a748a06e985677dce09223f5828c588668459b3303f46a1dca49a2",
  "acknowledged_residuals_hash": "sha256:4f53cda18c2baa0c0354bb5f9a3ecbe5ed12ab4d8e11ba873c2f11161202b945",
  "customer_bindings_hash": "sha256:4f53cda18c2baa0c0354bb5f9a3ecbe5ed12ab4d8e11ba873c2f11161202b945",
  "coverage_hash": "sha256:ee928505579fb105fd1521b9c42e867a593e0a5ed98c0770e3bdfbeab273533e",
  "capability_catalog_hash": "sha256:bd7fd23eb59b5521ef6780edec0667ce9b7ba9b5738dfa2701a575fb3efce930",
  "constraint_ir_hash": "sha256:f0c2143b95d74bc396f06980fff2beff51f489ff162895338381616f3c1264ae",
  "runtime_fact_schema_hash": "sha256:3fcf3af0a61f91a78b171ccd6247db9f0f908e1baf44aa50ece12349c44bb582",
  "domain_pack_hash": "sha256:78783654a8131cb7a6547ee2ed9507e1dced640aebe32d35057c385bb1dc4459",
  "compiler_binding_hash": "sha256:bd5fbbb96ea0bb5ed855a0586229f5d25f313c7fc4df9721cb8c897c5c3dbcd8",
  "semantic_commit_id": "semantic-commit-80a1ac9db0c6",
  "semantic_commit_hash": "sha256:80a1ac9db0c6bcd4fd03ca5328284f2476a3586113eb79447ae3391069448047",
  "semantic_commit_bundle_hash": "sha256:d8728bcfed9a18bef7bf189c8ea59059b400cba3ac5e23365819b0295f4d29af",
  "compiled_contract_hash": "sha256:00df2385728e0e48c415e5df40d5c7a7ccaa1285d0452848578b2a544b254432",
  "authority_identity_hash": "sha256:ffe474b6a911cc92679d30b9adc542854c83fe3d680329a9de770ac5df6301f2",
  "approval_record_hash": "sha256:1f7cc1e4a30e9d2bd969419eb2366e50c6a8d4126219bb08231cf5e5f45a2d35",
  "publication_manifest_hash": "sha256:bae35755129aa455df2b6faf6bd70b7895ef8ec6684cd85e0d005262a61640d2",
  "domain_pack": {
    "domain_pack_id": "repository-changes",
    "domain_pack_version": "3.0.0",
    "domain_pack_hash": "sha256:78783654a8131cb7a6547ee2ed9507e1dced640aebe32d35057c385bb1dc4459"
  },
  "compiled_contract_ref": "repository-mixed@3.0.0",
  "provenance_complete": true,
  "receipt_hash": "sha256:55ae85360e7afd0da75d645e2ba7138b5dafd93ac2584a3e6c8cb9d375c40e02"
}
