{
  "schema_version": "publication_receipt.v4",
  "receipt_id": "receipt-v4-52ee5594c92d37ccaf9c46c4f9b9072d254636a52c5eb1efa8851d9102aff66f",
  "publication_id": "release-example-create-only",
  "authority_ref": "repository-create-only@3.0.0",
  "published_at": "2026-09-12T12:05:00Z",
  "published_by": "example-release-publisher",
  "bundle_hash": "sha256:52ee5594c92d37ccaf9c46c4f9b9072d254636a52c5eb1efa8851d9102aff66f",
  "source_snapshot_hash": "sha256:ff5601216d1505cc8d8c9fb73fe3276d3a7852a083f302e8767e592ca1b3727f",
  "source_clauses_hash": "sha256:1c2e6f1b293d0b8804dc39c7589df058534d45b082b0ebe5b7089b96f6f6dc4b",
  "policy_translation_commitment_hash": "sha256:203f0c783579dbe001154adc62095b0a891ba4db1b1c3f467529ee6e1e9a44a0",
  "confirmed_controls_hash": "sha256:f5c53e7d98d84c1c90a29f0d431dea633c1e67d427b33550c5f6cb9be7d80289",
  "acknowledged_residuals_hash": "sha256:4f53cda18c2baa0c0354bb5f9a3ecbe5ed12ab4d8e11ba873c2f11161202b945",
  "customer_bindings_hash": "sha256:4f53cda18c2baa0c0354bb5f9a3ecbe5ed12ab4d8e11ba873c2f11161202b945",
  "coverage_hash": "sha256:f456dac305882961abbe8d5157720c6bd10d7d795152ffb497ec2c830e18710b",
  "capability_catalog_hash": "sha256:bd7fd23eb59b5521ef6780edec0667ce9b7ba9b5738dfa2701a575fb3efce930",
  "constraint_ir_hash": "sha256:fbe8eb4107ba88ab4862409be4cc0911ab22dcea2b5427e439781b80d8c3e557",
  "runtime_fact_schema_hash": "sha256:3fcf3af0a61f91a78b171ccd6247db9f0f908e1baf44aa50ece12349c44bb582",
  "domain_pack_hash": "sha256:78783654a8131cb7a6547ee2ed9507e1dced640aebe32d35057c385bb1dc4459",
  "compiler_binding_hash": "sha256:016661d783a45facf86375c0347b7c37567c1379e77b1d79d10c028159f90d85",
  "semantic_commit_id": "semantic-commit-7773d75b232a",
  "semantic_commit_hash": "sha256:7773d75b232a2a89a3236bf8e8809807cdf6e3fdfaa6fb4445e71b1e98fc293f",
  "semantic_commit_bundle_hash": "sha256:618033c3a840421d08eb28b996359cd8d5b2a6abe3bd90d3274287a2efbf6960",
  "compiled_contract_hash": "sha256:be6ced1145454e1c0b0b10efbbbe2610460b5700a63edec0f6b1bbc803172e75",
  "authority_identity_hash": "sha256:8f90523d60877ec1777a1c1ef4eebcad09944a8e35e983090bcaa6ab4a7bbea7",
  "approval_record_hash": "sha256:667eebeec0218e5bdf6fe76ab4b627d61a19ab6e91dd1821bfa86708132b17dc",
  "publication_manifest_hash": "sha256:1837c3b027f5ee25928c5968ccc9501386d687d2d51490db5c4371451b1495d5",
  "domain_pack": {
    "domain_pack_id": "repository-changes",
    "domain_pack_version": "3.0.0",
    "domain_pack_hash": "sha256:78783654a8131cb7a6547ee2ed9507e1dced640aebe32d35057c385bb1dc4459"
  },
  "compiled_contract_ref": "repository-create-only@3.0.0",
  "provenance_complete": true,
  "receipt_hash": "sha256:daf28dc75e5cf5b3efc6d25dbe4748e48b5c0fc06d9d6756021d54407fd354f0"
}
